ques_id,language,ques,ansTitle,ansContent,translation,translation_title,ques_translation
8526,DE,Credit überzogen,Weshalb ist mein Konto im Minus ,"Der Grund weshalb Ihr Konto im Minus ist, ist der Folgende:Der Geldbetrag (oder Gratisseitenbetrag) wird immer erst dann abgezogen wenn der Druckjob abgeschlossen ist. Damit wird verhindert das man bezahlen muss wenn der Druckjob nicht abgeschlossen werden konnte. Jedoch kann so nicht im voraus überprüft werden ob genug Credit für den Druck vorhanden ist. Deshalb kann es vorkommen das ein Konto ins Minus gerät. Grundsätzlich gibt es zwei Möglichkeiten um das Konto aufzuladen:Mit Kreditkarte überhttp://www.passwort.ethz.ch -> meine Services -> Prepaid. Mit Bargeld an einem VPP Schalter: Hönggerberg: HIL C36.1 Zentrum: HG D 48.2","The reason why your account is in the minus is the following: The amount of money (or free site amount) is always deducted only when the print job is completed. This prevents you having to pay if the print job could not be completed. However, it can not be checked in advance if there is enough credit for printing. Therefore it can happen that an account falls into the minus. Basically, there are two ways to charge the account: With credit card http://www.passwort.ethz.ch -&gt; my services -&gt; Prepaid. With cash at a VPP counter: Hönggerberg: HIL C36.1 Center: HG D 48.2",Why is my account down?,Credit overdrawn
8529,DE,Information NSG ,Malware ,"Sie wurden vor kurzem von Herr XXX kontaktiert, da Ihr PC mit Malware infiziert ist. Bitte bereinigen Sie Ihre Maschine umgehend und geben Sie uns ein Feedback. Wenn Sie Hilfe beim Bereinigen Ihres Rechners brauchen wenden Sie sich bitte an Ihre ISG. Aus Sicherheitsgründen müssen wir Ihren Zugang zum ETH Netz sperren, bis das Problem behoben ist.","You have recently been contacted by Mr. XXX because your PC is infected with malware. Please clean up your machine immediately and give us feedback. If you need help cleaning up your computer, please contact your ISG. For security reasons, we need to block your access to the ETH network until the problem is resolved.",Malware ,Information NSG 
8530,DE,Weiterleitung an ISG,Weiterleitung an ISG ,"Ihre Anfrage wurde direkt an Ihre zuständige Supportgruppe (ISG) des Departements weitergeleitet.Bitte beachten Sie, dass die Anfrage somit bei uns im Ticketssystem geschlossen wird.Für allfällige Rückfragen wenden Sie sich bitte direkt an Ihre ISG.http://www.id.ethz.ch/about/departments --> Kontakte der Departemente","Your request has been forwarded directly to your responsible support group (ISG) of the department. Please note that the request is therefore closed in our ticket system. For any queries, please contact your ISG.http: //www.id. ethz.ch/about/departments -&gt; Contacts of the departments",Weiterleitung an ISG,Weiterleitung an ISG
8531,DE,IDES Laufwerk lässt sich nicht verbinden,IDES Laufwerk verbinden ,"Um das IDES Laufwerk zu verbinden, klicken Sie bittehier.","To connect the IDES drive, please click here.",Connect IDES drive,IDES drive does not connect
8533,DE,CSR falsch eingereicht,CSR wurde falsch eingereicht ,Das CSR wurde nicht gemäss ETH Richtlinien über ethz.ra@id.ethz.cheingereicht. Bitte CSR gemäss Richtlinien (https://www1.ethz.ch/id/services/list/ssl/) an ethz.ra@id.ethz.ch schicken.,The CSR was not submitted in accordance with ETH guidelines via ethz.ra@id.ethz. Please send CSR according to the guidelines (https://www1.ethz.ch/id/services/list/ssl/) to ethz.ra@id.ethz.ch.,CSR was submitted incorrectly,CSR submitted incorrectly
8534,DE,Persönliche Homepage bearbeiten,Wie kann ich meine persönliche Homepage bearbeiten? ,Sie können den Homepageordner über Ihr persönliches Laufwerk bearbeiten.  Wie Sie auf dieses zugreifen können erfahren Siehier.,You can edit the homepage folder using your personal drive. You can find out how to access this here.,How can I edit my personal homepage?,Edit personal homepage
8513,DE,Passwort vergessen,Wie bekomme ich eine neues Passwort? ,Der Servicedesk kann Ihnen ein neues Passwort zukommen lassen. Am besten melden Sie sich telefonisch bei 044 632 77 77.,The service desk can send you a new password. The best way to contact us is by calling 044 632 77 77.,How do I get a new password?,Forgot Password
8514,DE,Büroadresse ändern,Wie kann ich meine Büroadresse ändern ,Die Büroadresse kann über die Webseitewww.adressen.ethz.changepasst werden.Achtung: Ein Login auf dieser Seite ist nur möglich wenn Sie einen laufenden Vertrag mit der ETH haben. Sollte ihre Anstellung noch nicht begonnen haben ist der Login nicht möglich.,The office address can be changed via the website www.adressen.ethz.change.Attention: Login on this page is only possible if you have a current contract with ETH. If your employment has not started yet you will not be able to log in.,How can I change my office address?,Change office address
8521,DE,Massenmail e-Mail ,Antwort Massenmail ,"Anbei die Infos zu der Mailliste:Adresse: XXX@.ethz.chBitte verschicken Sie mit dem Massenmail keine Anhänge, um unseren Mailserver nicht unnötig zu belasten. Bitte schreiben Sie im Betreff an wenn diese Mail gerichtet ist (z.B. An alle Mitarbeiter). Die Mailliste bleibt nur heute gültig, sie wird heute Nacht automatisch gelöscht.Achtung: Setzen Sie diese Adresse ins BCC-Feld, damit sie bei den Adressaten nicht auftaucht und nicht missbraucht werden kann!","Please find attached the information to the mailing list: Address: XXX @ .ethz.chPlease do not send any attachments with the mass mail in order not to burden our mail server unnecessarily. Please write in the subject if this mail is addressed (eg To all employees). The mail list will only be valid today, it will be automatically deleted tonight. Caution: Put this address in the BCC field, so that it does not appear at the addressee and can not be abused!",Answer mass mail,Bulk mail
8522,DE,Ich kann nicht mehr einloggen ,Passwort ändern via Admin Tool ,"Um Ihr Passwort zu ändern, loggen Sie sich bitte hier ein:http://www.passwort.ethz.ch","To change your password, please log in here: http: //www.passwort.ethz.ch",Change password via Admin Tool,I can not log in anymore
8523,DE,Account hat einen Lockout,Mein Account hat einen Lockout ,"Ihr Account hatte einen Lockout, weil das Passwort mehrmals falsch eingeben wurde. Eventuell haben Sie irgendwo in Ihrem System (z.B. im Mailclient oder einem Netzlaufwerk) noch ein altes Passwort gespeichert. Der Lockout wurde entfernt, der Login sollte also wieder funktionieren.","Your account had a lockout because the password was entered incorrectly several times. You may have stored an old password somewhere in your system (eg in the mail client or a network drive). The lockout was removed, so the login should work again.",My account has a lockout,Account has a lockout
8524,DE,Mailabsender sperren,Wie kann ich eine Mailadresse sperren ,Sie können den Absender auf Ihrer persönlichen Blacklist eintragen. Dazu gehen Sie wie folgt vor:Loggen Sie sich auf dieser Seite ein:http://www.passwort.ethz.chWechseln Sie ins Menü meine Services/ E-Mail SpamfilterDort können Sie die Adresse die Sie sperren möchten unter dem Punkt Blacklist eintragen.,"You can enter the sender on your personal blacklist. To do so, proceed as follows: Log in on this page: http: //www.passwort.ethz.chSwitch to the menu My Services / E-Mail SpamfilterThere you can enter the address you want to block under the item blacklist.",How can I block an email address?,Block mail sender
8525,DE,Mailheader anzeigen,WIe kann ich den Mailheader ansehen? ,"Im Webmail (Outlook Web App) gehen Sie wie folgt vor:Im Web Outlook doppelklicken Sie das Mail, um es zu öffnen (die Vorschau genügt nicht).Dann klicken Sie in der Symbolleiste auf das Icon Nachrichtendetails Kopieren Sie den Inhalt der Box ""Internet Mail-Kopfzeilen"" in Ihre Antwort auf dieses Ticket.","In Webmail (Outlook Web App), do the following: In Web Outlook, double-click the mail to open it (the preview is not enough). Then click on the icon Message Details on the toolbar. Copy the contents of the &quot;Internet Mail Headers &quot;in your response to this ticket.",How can I view the mail header?,Show mail header
8505,DE,Mailabsender wird irrtümlich blockiert,Eine Mail wird irrtümlich als Spam blockiert ,Sie können den Absender auf Ihrer persönlichen Whitelist eintragen. Dazu gehen Sie wie folgt vor:Loggen Sie sich auf folgender Seite ein:http://www.passwort.ethz.chWechseln Sie ins Menü meine Services/ E-Mail SpamfilterDort können Sie die Adresse die Sie sperren möchten unter dem Punkt Whitelist eintragen.,"You can enter the sender on your personal whitelist. To do so, proceed as follows: Log in on the following page: http: //www.passwort.ethz.chSwitch to the menu My Services / E-Mail SpamfilterThere you can enter the address you want to block under the item Whitelist.",An email is mistakenly blocked as spam,Mail sender is mistakenly blocked
8508,DE,Massenmail Bewilligung,Informationen für Bewilligung Massenmail ,Solche Listen werden von uns erstellt. Allerdings nur wenn eine Bewilligung der HK (bei Mitarbeitern) oder Rektorat (bei Studenten) vorliegt. Um eine Bewilligung einzuholen brauchen wir folgende Informationen:An wenn soll die Liste gehen?Wann wird die Mail verschickt?Von welcher Adresse wird die Mail verschickt?Um was geht es in der Mail?,"Such lists are created by us. However, only if there is a permit from the HK (for employees) or Rectorate (for students). In order to obtain a permit, we need the following information: To what should the list go to? When will the mail be sent? From which address will the mail be sent? What is the purpose of the mail?",Information for grant bulk mail,Mass Mail Grant
8527,DE,NAS Berechtigungen neu setzten,NAS Berechtigungen neu gesetzt ,Ich habe die Berechtigungen neu gesetzt. Könnten Sie es bitte noch einmal probieren?,I have reset the permissions. Could you please try again?,NAS permissions reset,Reset NAS permissions
8510,DE,Einrichten VPN,Wie lauten die VPN Einstellungen der ETH? ,Die VPN Einstellungen der ETH sind wie folgt:Server: sslvpn.ethz.chVerschlüsselung: Cisco IPSecUname: Ihr ETH-UnamePasswort: Ihr PasswortGruppenname: ETHZ-spezialGruppenpasswort: Können Sie hier einsehen:https://www1.ethz.ch/id/servicedesk/guide/vpn/vpn_secret,The VPN settings of ETH are as follows: Server: sslvpn.ethz.chCoding: Cisco IPSecUname: Your ETH-UnamePasswort: Your passwordGroup name: ETHZ-SpezialGruppenpasswort: You can see here: https: //www1.ethz.ch/id/servicedesk / guide / vpn / vpn_secret,What are the VPN settings of the ETH?,Setting up VPN
8510,DE,Einrichten VPN,Installation VPN Client ,Anleitung zur Installation des VPN Clients finden Sie auf dieser Website:https://www1.ethz.ch/id/servicedesk/guide/vpn/index,Instructions for installing the VPN client can be found on this website: https: //www1.ethz.ch/id/servicedesk/guide/vpn/index,Installation VPN Client ,Setting up VPN
8529,DE,Information NSG ,VPN Missbrauch ,"Sie wurden vor kurzem von Herr XXX kontaktiert, da Ihr VPN Zugang wahrscheinlich von Drittpersonen missbraucht wird. Bitte ändern Sie Ihr Passwort über:www.passwort.ethz.chund geben Sie uns ein Feedback. Aus Sicherheitsgründen müssen wir Ihren Zugang zum ETH Netz sperren, bis das Problem behoben ist.","You have recently been contacted by Mr. XXX, as your VPN access is likely to be misused by third parties. Please change your password via: www.passwort.ethz.chand give us a feedback. For security reasons, we need to block your access to the ETH network until the problem is resolved.",VPN abuse,Information NSG 
8512,DE,Manuelle Aktivierung Office,Office manuell aktivieren ,"Um Office manuel zu aktivieren sind folgende Schritte nötig:Command Fenster als Administrator ausführen (Rechtsklick - Als Administrator ausführen).Mit ""cd"" ins Verzeichnis der Office Installation wechseln: cd c:\Programm files\Microsoft Office\Office14   (Der Pfad kann natürlich je nach Installation abweichen. Ansonsten das System nach dem Office14 Ordner suchen lassen)Nun sind folgende 3 Befehle abzuschicken:cscript OSPP.VBS /remhst(entfernt den momanten Aktivierungsserver)cscript OSPP.VBS /sethst:kms1.ethz.ch (Setzt den Aktivierungsserver auf kms1.ethz.ch)cscript OSPP.VBS /act (startet die AktivierungNun wird das Produkt aktiviert und in der Eingabeaufforderung erscheint die Bestätigung. Nach einem Neustart der Office Programme ist die Aktivierung getätigt.","To activate Office manually, you need to do the following steps: Run Command window as administrator (right-click - Run as administrator). Switch to the directory of the Office installation with &quot;cd&quot;: cd c: \ Program files \ Microsoft Office \ Office14 (The path can, of course depending on the installation, otherwise the system can be searched for the Office14 folder) Now the following 3 commands have to be sent: cscript OSPP.VBS / remhst (removes the momanten activation server) cscript OSPP.VBS /sethst:kms1.ethz.ch (Sets the activation server on kms1.ethz.ch) cscript OSPP.VBS / act (starts the activationNow the product is activated and the confirmation appears in the prompt.After a restart of the Office programs, the activation is made.",Activate Office manually,Manual Activation Office
8535,DE,Beim Servicedesk vobeikommen,Beim Servicedesk vobeikommen ,Sie können gerne beim Service Desk vorbeikommen.   Er befinden uns im HG E 11 und die Öffnungszeiten sind wie folgt: 09:30-11:00 - 13:30-16:00,You are welcome to call the service desk. It is located in the HG E 11 and the opening hours are as follows: 09: 30-11: 00 - 13: 30-16: 00,Visiting the service desk,Visiting the service desk
8516,DE,Wie kann ich eine Telefonkonferenz einleiten?,Telefonkonferenz ,"Wenn nicht mehr als 7 Personen an der Konferenz teilnehmen, können Sie das Gespräch direkt von Ihrem Telefon aus einleiten. Eine Anleitung wie genau das funktioniert finden Siehier.Bitte verwenden Sie die Anleitung unter dem Punkt Optipoint oder Optiset. Wenn mehr als 7 Personen an der Konferenz teilnehmen sollten können Sie das System der MMS verwenden (https://www1.ethz.ch/id/services/list/mms_vc/services/conferencecall), welches über den VC Helpdesk bestellt werden kann (vc-helpdesk@id.ethz.ch).","If no more than 7 people join the conference, you can initiate the call directly from your phone. You can find instructions on how exactly this works here. Please use the manual under Optipoint or Optiset. If more than 7 people are attending the conference, you can use the MMS system (https://www1.ethz.ch/id/services/list/mms_vc/services/conferencecall), which can be ordered through the VC Helpdesk ( vc-helpdesk@id.ethz.ch).",telephone conference,How can I initiate a telephone conference?
8536,DE,Prepaid nicht geladen,Credit nicht geladen ,Die Transaktion wurde bei Saferpay nur reserviert. (Bitte die Einzahlung immer mit dem Close Knopf abschliessen und warten dass unsere Seite wieder geladen wird).  Die Einzahlung wurde freigegeben und das Geld gutgeschrieben.,The transaction was only reserved at Saferpay. (Please always complete the deposit with the Close button and wait for our page to be reloaded). The deposit was released and the money credited.,Credit not loaded,Prepaid not loaded
8538,DE,Was ist Ihre ZO Nummer?,ZO-Rechnernummer ,"Könnten Sie uns Ihre Rechnernummer mitteilen? Sie sollte auf einem blauen Schild mit Aufdruck ""Betriebsinformatik"" oder „ETH Zürich ID Services Delivery“ stehen.",Could you tell us your computer number? It should be printed on a blue sign with the inscription &quot;Betriebinformatik&quot; or &quot;ETH Zurich ID Services Delivery&quot;.,ZO computer number,What is your ZO number?
8517,DE,Passwort vergessen,Passwort vergessen ,"Leider dürfen wir das Passwort weder telefonisch noch per E-Mail herausgeben. Sie können es bei uns am Service Desk abholen (HG E 11) oder wir schicken Ihnen das Passwort nach Hause. In diesem Fall geben Sie uns bitte folgende Angaben: GeburtsdatumAdresseWenn Sie das Passwort bei uns abholen möchten, wir haben von 9.30 bis 11 Uhr und von 13.30 bis 16 Uhr offen. Nehmen Sie Ihre Legi resp. Ihren Mitarbeiterausweis mit.","Unfortunately we are not allowed to give out the password by phone or e-mail. You can pick it up at our service desk (HG E 11) or we will send you the password home. In this case, please provide us with the following information: Date of birthAdress If you wish to pick up the password from us, we are open from 9.30 am to 11 am and from 1.30 pm to 4 pm. Take your Legi resp. Your employee badge with.",Forgot Password,Forgot Password
8563,DE,Wie ersetze ich das Zertifikat für die verschlüsselte Übertragung des Bildes der Türkamera ZUE?,Zertifikat erneuern bei der Türkamera am ZUE ,"Das ZUE können nur MTEC-Mitglieder mit ihrer Mitarbeiterkarte betreten. Gäste müssen klingeln. Es hat auf jedem Stock ein spezielles Telefon, das klingelt und mit dem man die Türe öfffnen kann.  Damit man sehen kann, wer geklingelt hat, kann das Bild der Videokamera für eine Minute angeschaut werden. Nur Personen, die beim Video Server eingetragen sind, können eine Verbindung aufbauen. Die Verbindung ist verschlüsselt und kann nur im MTEC Netzwerk aufgebaut werden.Das Zertifikat für die Verschlüselung muss alle zwei Jahre erneuert werden.Zertifikat erneuern alten request entfernen ->  https://eingan-zue.ethz.ch-> anmlden als admin - setup - system options - https - Created Request -> RemoveCreate Certificate Request... -> eben dort     Country: CH     State or province: Zuerich    Locality: Zuerich    Organization: ETH Zuerich    Organization Unit: MEC    Common Name: eingang-zue.ethz.chRequest an folgende E-Mailadresse  senden mit der Bitte ein Zertifikat zu erstellen:ra@id.ethz.ch","The ZUE can only enter MTEC members with their employee card. Guests have to ring the bell. It has on each floor a special telephone that rings and with which you can open the door. So you can see who has rung, the image of the video camera can be viewed for a minute. Only people who are registered with the Video Server can establish a connection. The connection is encrypted and can only be set up in the MTEC network.The certificate for the encryption must be renewed every two years.Remove certificate remove old request -&gt; https: //eingan-zue.ethz.ch-&gt; anmlden as admin - setup Country: CH State or province: Zuerich Locality: Zuerich Organization: ETH Zuerich Organization Unit: MEC Common Name: eingang-zue.ethz.chRequest to send the following e-mail address with the request to create a certificate: ra@id.ethz.ch",Renew certificate at the door camera at ZUE,How do I replace the certificate for the encrypted transmission of the image of the door camera ZUE?
8519,DE,Login für IDES-Netzlaufwerk geht nicht,Login auf IDES-Laufwerk ,"Ihr Kennwort wird auf ihrem Rechner gesucht, nicht auf unserem Server. Wählen Sie das untere Feld an 'anderes Konto wählen' und geben Sie ihren Usernamen mit <username> ein. Nach Eingabe des Kennwortes sollte die Verbindung klappen.","Your password will be searched on your computer, not on our server. Select the field below to &#39;choose another account&#39; and enter your username <username> on. After entering the password, the connection should work.",Login to IDES drive,Login for IDES network drive is not working
8541,DE,Wie kann man auf einem VPP Touch Drucker den Druckjob auslösen?,VPP-Touch Drucker  ,"Zuerst muss der VPP PIN im nethz-Admintool (www.passwort.ethz.ch) erstellen werden, danach kann über VPP-Touch ein Druckjob ausgelöst werden.  Weitere Informationen finden Sie hier: http://www.id.ethz.ch/services/list/vpp/prs","First, the VPP PIN must be created in the nethz admin tool (www.passwort.ethz.ch), then a print job can be triggered via VPP-Touch. Further information can be found here: http://www.id.ethz.ch/services/list/vpp/prs",VPP-Touch Drucker  ,How can I trigger the print job on a VPP Touch printer?
8542,DE,Wie installiere ich Software von IDES?,Software von IDES installieren ,"Bitte laden Sie zunächst alle Software lokal auf Ihrem Computer über ""Netzlaufwerk verbinden"", der Computer muss am  ETH-Netzwerk angeschlossen sein, wenn nicht starten Sie bitte vorher den VPN Client.  Danach starten Sie die Installation von Ihrem Computer.  Wenn das Passwort von IDES nicht akzeptiert wird, melden Sie sich auf der Webseite von IDES an (www.ides.ethz.ch) klicken Sie oben auf ""Einstellungen"" danach auf ""Passwort ändern"" und speichern Sie wieder Ihr nethz-Passwort ab, danach können Sie die Netzlaufwerk_Verbindung herstellen. Hier finden Sie die Anleitung wie Sie VPN installieren zu finden:https: //www./id.ethz.ch/servicedesk/guide/vpn/indexHier finden Sie die Anleitung wie Sie Netzlaufwerk verbinden könnenhttps://www.id.ethz.ch//servicedesk/guide/ides/ides_manual","Please first load all software locally on your computer via &quot;Connect network drive&quot;, the computer must be connected to the ETH network, if not, please start the VPN client first. Then start the installation from your computer. If the IDES password is not accepted, log in to the IDES website (www.ides.ethz.ch), click &quot;Settings&quot; above, then &quot;Change password&quot; and save your nethz password again. then you can create the network drive connection. You can find the instructions on how to install VPN here: https: //www./id.ethz.ch/servicedesk/guide/vpn/indexHere you can find the instructions on how to connect network drive htps: //www.id.ethz. ch // servicedesk / guide / ides / ides_manual",Install software from IDES,How do I install IDES software?
8570,DE,Matlab Setup bricht ab,Setup von Matlab bricht ab ,"Sie müssen eine Netzlaufwerkverbindung zu ihrem IDES-Ordner herstellen und Matlab auf ihren Rechner kopieren, damit die Installation reinbungslos verläuft. Eine Anleitung wie Sie das Netzlaufwerk erstellen, finden Sie im Anhang.","You need to make a network drive connection to your IDES folder and copy Matlab to your machine for the installation to be clean. For instructions on how to create the network drive, see the appendix.",Setup of Matlab stops,Matlab setup stops
8545,DE,Wo bekomme ich ein neues nethz-Passwort,nethz-Passwort ,Der Kundin / Dem Kunden wird nach Beantworten der Sicherheitsfragen ein neues nethz-Passwort per SMS zugeschickt.,"After answering the security questions, the customer will be sent a new nethz password by SMS.",nethz password,Where can I get a new nethz password?
8573,DE,Matrikelnummer ändern,Matrikelnummer mit Script ändern ,Zu Händen Alfred Sohm oder Markus Kreuzer  Kannst du bitte die unten aufgeführte Matrikelnummer mittels Skript ändern.  Besten Dank und freundliche Grüsse,For the sake of Alfred Sohm or Markus Kreuzer Can you please change the below listed student number by script. Many thanks and kind regards,Change student number with script,Change matriculation number
8549,DE,Wie bekommt man Zugang zu eDoz?,Zugang zu eDoz ,Zugang zu eDoz kann Ihnen nur Ihr Professor geben oder das Rektorat. Das Service Desk hat leider keine Berechtigungen in diesem System.,"Only your professor or the Rectorate can give you access to eDoz. Unfortunately, the service desk does not have permissions in this system.",Access to eDoz,How do you get access to eDoz?
8574,DE,Telefonnummer ändern,Telefoniesupport zuständige Person kontaktieren ,"Der Telefonie-Support wie Aendern der Telefonnummer ist seit 2010 dezentral in den Departementen organisiert. Darf ich Sie freundlich bitten, die für Telefoniesupport zuständige Person zu kontaktieren, damit diese Ihre neue Telefonnummer zuerst im Netcenter erfasst. Die Kontakt-Adresse finden Sie:hier.Für Ihr Verständnis danke ich Ihnen und grüße Sie freundlich.","Telephony support, such as changing the telephone number, has been organized locally since 2010 in the departments. May I kindly ask you to contact the telephony support person to have your new phone number registered in Netcenter first. The contact address can be found here. For your understanding, I thank you and greet you kindly.",Telephone support contact responsible person,Change phone number
8539,DE,DNS löst nicht mehr auf,DNS,Zur Zeit haben wir DNS-Probleme in weiten Teilen der ETH. Einige Websites und -Services sind davon betrofffen.Bitte versuchen Sie es zu einem späteren Zeitpunkt nochmals.,At the moment we have DNA problems in much of the ETH. Some websites and services are affected. Please try again later.,DNS,DNS does not dissolve anymore
8540,DE,WIe bekomme ich den Service RDS?,Service RDS bestellen ,,,Order service RDS,How do I get the service RDS?
8562,DE,Passwort unterwegs,Passwort unterwegs ,"Ihr Passwort ist unterwegs. Bitte beachten Sie, dass dieses Passwort nur für das Login auf der Webseite passwort.ethz.ch passwort.ethz.chgültig ist. Auf dieser Seite müssen Sie sich ein neues Passwort setzen. ",Your password is on the way. Please note that this password is only valid for the login on the website password.ethz.ch password.ethz.ch valid. On this page you have to set a new password.,Password on the way,Password on the way
8566,DE,Passwort vergessen mit Handy-Nr.,neues Passwort mit Handy-Nr. ,Glücklicherweise haben Sie eine Handy-Nummer hinterlegt. Damit können wir ihr neues Passwort per sms zustellen. Zur Verifizierung geben Sie uns bitte noch folgendes bekannt:Ihr GeburtsdatumIhre WohnadresseIhre Handynummer (zum Vergleich)Vielen Dank,"Fortunately, you have a cell phone number deposited. With this we can send your new password via sms. For verification, please tell us the following: Your date of birthYour home addressYour mobile number (for comparison) Thank you",new password with mobile no.,Forgot password with mobile no.
