ques_id,language,ques,ansTitle,ansContent,translation,translation_title,ques_translation
8502,EN,Received a phishing mail?,Phishing Mail warning ,"This is a phishing mail. You should delete it. If you clicked on the link and filled in your credentials, it is absolutely necessary to change the password immediately.Tips for changing the password are found here:https://www1.ethz.ch/id/servicedesk/guide/change_pw/index_EN","This is a phishing mail. You should delete it. If you clicked on the link and filled in your credentials, it is absolutely necessary to change the password immediately.Tips for changing the password are found here:https://www1.ethz.ch/id/servicedesk/guide/change_pw/index_EN",Phishing Mail warning ,Received a phishing mail?
8503,EN,Lockout on Account ,My account is locked ,"You had a lockout on your account because you tipped in the password wrong. Maybe you have saved a wrong password on your system (Mailclient, networkdrive). The lockout is now removed and you should be able to login again.","You had a lockout on your account because you tipped in the password wrong. Maybe you have saved a wrong password on your system (Mailclient, networkdrive). The lockout is now removed and you should be able to login again.",My account is locked ,Lockout on Account 
8506,EN,Blocking mailsender,Block a mailsender ,You can add the sender on your personal blacklist. The following steps are required for this: Login on the pagehttp://www.password.ethz.chClick on meine Services/ E-Mail SpamfilterNow add the address in the field blacklist.,You can add the sender on your personal blacklist. The following steps are required for this: Login on the pagehttp://www.password.ethz.chClick on meine Services/ E-Mail SpamfilterNow add the address in the field blacklist.,Block a mailsender ,Blocking mailsender
8509,EN,Credit overdrawn,I can't print anymore ,Your credit is 6.90.- in minus. You have to load your account if you want to print. You can do that on the web with creditcard:http://www.password.ethz.ch-> meine Services -> Creditor in a VPP office (Hönggerberg: HIL C36.1 or Zentrum: HG D 48.2).,Your credit is 6.90.- in minus. You have to load your account if you want to print. You can do that on the web with creditcard:http://www.password.ethz.ch-> meine Services -> Creditor in a VPP office (Hönggerberg: HIL C36.1 or Zentrum: HG D 48.2).,I can't print anymore ,Credit overdrawn
8509,EN,Credit overdrawn,Why is my account in minus ,The reason why your account is minus is the following.  The amount (or the free sites) will be deducted from your account after the print job is finished. So we can prevent that you have to pay when the printjob is not finished. But we can't check if you have enough credit on your account for the printing job that you want to do. That's why it is possible that your account is in minus. You have two possibilities to charge your account :Via creditcard overhttp://www.passwort.ethz.ch-> meine Services -> Prepaid.WIth money a one of the VPP desks: Hönggerberg: HIL C36.1 Zentrum: HG D 48.2,The reason why your account is minus is the following.  The amount (or the free sites) will be deducted from your account after the print job is finished. So we can prevent that you have to pay when the printjob is not finished. But we can't check if you have enough credit on your account for the printing job that you want to do. That's why it is possible that your account is in minus. You have two possibilities to charge your account :Via creditcard overhttp://www.passwort.ethz.ch-> meine Services -> Prepaid.WIth money a one of the VPP desks: Hönggerberg: HIL C36.1 Zentrum: HG D 48.2,Why is my account in minus ,Credit overdrawn
8528,EN,Reset NAS permissions,Reset NAS permissions ,I've reset your permissions. Can you please try it again?,I've reset your permissions. Can you please try it again?,Reset NAS permissions ,Reset NAS permissions
8511,EN,Settings for VPN,VPN settings of the ETH ,The settings for the ETH VPN are as follows:Server: sslvpn.ethz.chDecryption-typ: ipsec-pskUsername: Your ETH-UsernamePassword: Your passwordGroupname: ETHZ-spezialGrouppassword: This information you can find on this page:https://www1.ethz.ch/id/servicedesk/guide/vpn/vpn_secret,The settings for the ETH VPN are as follows:Server: sslvpn.ethz.chDecryption-typ: ipsec-pskUsername: Your ETH-UsernamePassword: Your passwordGroupname: ETHZ-spezialGrouppassword: This information you can find on this page:https://www1.ethz.ch/id/servicedesk/guide/vpn/vpn_secret,VPN settings of the ETH ,Settings for VPN
8507,EN,Mail blocked mistakenly,Mail blocked mistakenly ,You can add the sender on your personal whitelist. The following steps are required for this:Login on the pagehttp://www.password.ethz.chClick on meine Services/ E-Mail Spamfilter.Now add the address in the field whitelist.,You can add the sender on your personal whitelist. The following steps are required for this:Login on the pagehttp://www.password.ethz.chClick on meine Services/ E-Mail Spamfilter.Now add the address in the field whitelist.,Mail blocked mistakenly ,Mail blocked mistakenly
8511,EN,Settings for VPN,Installation VPN Client ,You can find all the informations for the VPN client installation on this webpage:https://www1.ethz.ch/id/servicedesk/guide/vpn/index,You can find all the informations for the VPN client installation on this webpage:https://www1.ethz.ch/id/servicedesk/guide/vpn/index,Installation VPN Client ,Settings for VPN
8532,EN,How can I install software from IDES?,Software installation from IDES ,"Please download first all software local  to your computer with ""Map network drive"", the computer must be on the  ETH Network, if not please start the VPN Client before. Then start the  installation from your computer.Here you will find the instructions:VPNMap network drive to IDESIf the password from IDES will not accepted, please go to the webpage from ideshttp://www.ides.ethz.chand login, go to ""Voreinstellungen"" and click on ""Passwort ändern"" and  set again your nethz-password and try again to map a network drive.","Please download first all software local  to your computer with ""Map network drive"", the computer must be on the  ETH Network, if not please start the VPN Client before. Then start the  installation from your computer.Here you will find the instructions:VPNMap network drive to IDESIf the password from IDES will not accepted, please go to the webpage from ideshttp://www.ides.ethz.chand login, go to ""Voreinstellungen"" and click on ""Passwort ändern"" and  set again your nethz-password and try again to map a network drive.",Software installation from IDES ,How can I install software from IDES?
8515,EN,Come by servicedesk,Come by servicedesk ,You can come to the service desk.   It is at the HG E 11 and the openingstimes are: 09:30-11:00 and 13:30-16:00,You can come to the service desk.   It is at the HG E 11 and the openingstimes are: 09:30-11:00 and 13:30-16:00,Come by servicedesk ,Come by servicedesk
8537,EN,Prepaid not loaded,Credit not loaded ,"The payment was stuck in the ""reservation"" stage, because you forgot to close the transaction with the ""close"" button.The payment is now completed and the money is available for printing.Please remember: always close the transaction window with the ""close"" button and wait until the ETH account summary is fully displayed after a payment.","The payment was stuck in the ""reservation"" stage, because you forgot to close the transaction with the ""close"" button.The payment is now completed and the money is available for printing.Please remember: always close the transaction window with the ""close"" button and wait until the ETH account summary is fully displayed after a payment.",Credit not loaded ,Prepaid not loaded
8561,EN,Password forgotten ,Password forgotten ,Unfortunately we are not able to send your new password by email or by phone. You can pick up your new password at our desk at HG E 11 (main building) or we send it to your registred address. In case of sending the password by post please give us:your birthdateyour addressIf you want to pick up your passwort we have open from 9.30 to 11 am and from 1.30 to 4 pm. Take the student/ETH card with you.,Unfortunately we are not able to send your new password by email or by phone. You can pick up your new password at our desk at HG E 11 (main building) or we send it to your registred address. In case of sending the password by post please give us:your birthdateyour addressIf you want to pick up your passwort we have open from 9.30 to 11 am and from 1.30 to 4 pm. Take the student/ETH card with you.,Password forgotten ,Password forgotten 
8518,EN,Password on the way,Password on the way ,Your password is on the way. Please note that this password is only good for login at  password.ethz.chwhere you should change it immediately.,Your password is on the way. Please note that this password is only good for login at  password.ethz.chwhere you should change it immediately.,Password on the way ,Password on the way
8565,EN,login for IDES network drive does not work,login for IDES network drive does not work ,Your password was seeked on your computer instead on our server. Please choose the field 'another Account' and type in your username with <username>. After entering your password the connection of your IDES network drive should work.,Your password was seeked on your computer instead on our server. Please choose the field 'another Account' and type in your username with <username>. After entering your password the connection of your IDES network drive should work.,login for IDES network drive does not work ,login for IDES network drive does not work
8569,EN,None,VPP-Touch Printer ,"First you have to create a VPP PIN Code in the nethz-admin tool (www.password.ethz.ch) under ""My services"". Then you should be able to print.Further you can findhere.","First you have to create a VPP PIN Code in the nethz-admin tool (www.password.ethz.ch) under ""My services"". Then you should be able to print.Further you can findhere.",VPP-Touch Printer ,None
8544,EN,Thanks for feedback,Thanks for feedback ,Great news! Have many thanks for your feedback.,Great news! Have many thanks for your feedback.,Thanks for feedback ,Thanks for feedback
8571,EN,Matlab setup cancels,setup of matlab installation aborts ,"First, you have to map your IDES-folder to a network drive. After that you should copy the whole folder 2014a from your IDES Matlab folder to your local harddisk. Finally you are able to begin the matlab installation from your local harddisk. Please follow strictly the instalallaton guide you receive from IDES by e-mail. A description how to connect your IDES network drive is attached to this e-mail.","First, you have to map your IDES-folder to a network drive. After that you should copy the whole folder 2014a from your IDES Matlab folder to your local harddisk. Finally you are able to begin the matlab installation from your local harddisk. Please follow strictly the instalallaton guide you receive from IDES by e-mail. A description how to connect your IDES network drive is attached to this e-mail.",setup of matlab installation aborts ,Matlab setup cancels
8550,EN,How to access to eDoz?,Access to eDoz ,Only your professor or the rector's office can give you access to eDoz. The service desk has no access to this system.,Only your professor or the rector's office can give you access to eDoz. The service desk has no access to this system.,Access to eDoz ,How to access to eDoz?
8575,EN,Change phone number,Contact the responsible person for telephony support ,The telephony support such modify the phone number is decentralized organized in the departments since 2010. May I kindly ask you to contact  the person which is responsible for telephony. They have to enter first yournew phone number in the Netcenter. You can find the contact address here:www.netcenter.ethz.ch,The telephony support such modify the phone number is decentralized organized in the departments since 2010. May I kindly ask you to contact  the person which is responsible for telephony. They have to enter first yournew phone number in the Netcenter. You can find the contact address here:www.netcenter.ethz.ch,Contact the responsible person for telephony support ,Change phone number
8564,EN,How do I replace the certificate for the encrypted transfer of the image from the door camera ZUE?,Renew Certificate at the door camera at the ZUE ,"The ZUE may only enter MTEC members of their staff card. Guests must ring the bell. It has on each floor, a special telephone that is ringing and with which you can open the door. So you can see who has rung, the picture of the video camera for a minute can be viewed. Only persons who are registered in the video server can connect to. The connection is encrypted and can only be built in MTEC network. The certificate for the encryption via, must be renewed every two years.Zertifikat erneuern. -> alten request entfernen https://eingan-zue.ethz.ch -> anmlden als admin - setup - system options - https - Created Request -> Remove Create Certificate Request... -> eben dort    Country: CH    State or province: Zuerich    Locality: Zuerich    Organization: ETH Zuerich    Organization Unit: MEC    Common Name: eingang-zue.ethz.chRequest an folgende E-Mailadresse  senden mit der Bitte ein Zertifikat zu erstellen.ra@id.ethz.ch","The ZUE may only enter MTEC members of their staff card. Guests must ring the bell. It has on each floor, a special telephone that is ringing and with which you can open the door. So you can see who has rung, the picture of the video camera for a minute can be viewed. Only persons who are registered in the video server can connect to. The connection is encrypted and can only be built in MTEC network. The certificate for the encryption via, must be renewed every two years.Zertifikat erneuern. -> alten request entfernen https://eingan-zue.ethz.ch -> anmlden als admin - setup - system options - https - Created Request -> Remove Create Certificate Request... -> eben dort    Country: CH    State or province: Zuerich    Locality: Zuerich    Organization: ETH Zuerich    Organization Unit: MEC    Common Name: eingang-zue.ethz.chRequest an folgende E-Mailadresse  senden mit der Bitte ein Zertifikat zu erstellen.ra@id.ethz.ch",Renew Certificate at the door camera at the ZUE ,How do I replace the certificate for the encrypted transfer of the image from the door camera ZUE?
8567,EN,Password forgotten with cell phone,Password with cell phone ,Fortunately we have your cell phone registered so we are able to send your new password via short message. Please send us following information about you:your DoByour home addressyour cell phone numer (to compare)many thanks,Fortunately we have your cell phone registered so we are able to send your new password via short message. Please send us following information about you:your DoByour home addressyour cell phone numer (to compare)many thanks,Password with cell phone ,Password forgotten with cell phone
8572,EN,Office-address manually entered,Office-address is registered ,I’ve edited an office-address / telephone number for XXX acting on the instruction. The office-address will be published in application “People Search”https://www.bi.id.ethz.ch/personensuche/searchPersonenPre.donot later than tomorrow.,I’ve edited an office-address / telephone number for XXX acting on the instruction. The office-address will be published in application “People Search”https://www.bi.id.ethz.ch/personensuche/searchPersonenPre.donot later than tomorrow.,Office-address is registered ,Office-address manually entered
8548,EN,Change matriculation,Change Matriculation with scripts ,To Alfred Sohm or Markus Kreuzer  Can you please change the matriculation number listed below.  Many thanks and kind regards,To Alfred Sohm or Markus Kreuzer  Can you please change the matriculation number listed below.  Many thanks and kind regards,Change Matriculation with scripts ,Change matriculation
8578,EN,no credits for print,credits clearing ,Unfortunately your credit account has a negative balance. At password.ethz.ch you have to possibility to clear your balance by credit card (meine services -> prepaid) or you can clear by cash at one of our printing center (HG D 48.2 or HIL C 45).,Unfortunately your credit account has a negative balance. At password.ethz.ch you have to possibility to clear your balance by credit card (meine services -> prepaid) or you can clear by cash at one of our printing center (HG D 48.2 or HIL C 45).,credits clearing ,no credits for print
8551,EN,File / Folder deleted,Restore of files / folders ,Into the folder were the removed files/folders were make a right click in the empty area and select 'properties' and then 'previous versions'.  The folder is listed and sorted by date.Choose the appropriate date. Now you see the content of this folder at that time and you can copy your file whereever you  want.That way you are able to restore files/folders not longer deleted than seven days.,Into the folder were the removed files/folders were make a right click in the empty area and select 'properties' and then 'previous versions'.  The folder is listed and sorted by date.Choose the appropriate date. Now you see the content of this folder at that time and you can copy your file whereever you  want.That way you are able to restore files/folders not longer deleted than seven days.,Restore of files / folders ,File / Folder deleted
8553,EN,Certificate ready ,Certificate ready for download ,Your certificate is now created. You should receive a mail with the downloadinformations in a few minutes.,Your certificate is now created. You should receive a mail with the downloadinformations in a few minutes.,Certificate ready for download ,Certificate ready 
8555,EN,I want to set an Out of Office Assistant,How to use the Out of Office Assistant in Outlook ,"You can set up an office message in Outlook Web App. By logging on to the following website: www.mail.ethz.chPlease click on the top on the right side  on""Options"" and click on "" automatic replies"". Enable the option ""Automatically send answers"" and enter the desired time period and your Out of Office message.  Best regards","You can set up an office message in Outlook Web App. By logging on to the following website: www.mail.ethz.chPlease click on the top on the right side  on""Options"" and click on "" automatic replies"". Enable the option ""Automatically send answers"" and enter the desired time period and your Out of Office message.  Best regards",How to use the Out of Office Assistant in Outlook ,I want to set an Out of Office Assistant
8579,EN,I want to call to foreign countries ,"Connect through the ""111"" (Switchboard ETH) ","In the neighboring countries of Switzerland, USA, Canada and England its possiple to dial directly, in all other countries the call must be allowed to connect through the 111 Switchboard.","In the neighboring countries of Switzerland, USA, Canada and England its possiple to dial directly, in all other countries the call must be allowed to connect through the 111 Switchboard.","Connect through the ""111"" (Switchboard ETH) ",I want to call to foreign countries 
8871,EN,Would you like to customize the navigation links in SharePoint?,Would you like to customize the navigation links? ,"You can add a new link to the navigation by dragging an app from the Site Contents page directly to the navigation, or by clicking ""link"" and then entering the URL.Drag an app from Site Contents to the navigation.The easiest way to add a link is to drag an app from the Site Contents page to the navigation.Go to the Site Contents page: click ""Settings""/ ""Site contents""Click ""EDIT LINKS"" on the Quick Launch or the top navigation, depending on where you want to add a link.Click the app you want to add and drag it to where you want it on the navigation.(Refresh the page (F5) to see the animation again.)Click ""Save"".","You can add a new link to the navigation by dragging an app from the Site Contents page directly to the navigation, or by clicking ""link"" and then entering the URL.Drag an app from Site Contents to the navigation.The easiest way to add a link is to drag an app from the Site Contents page to the navigation.Go to the Site Contents page: click ""Settings""/ ""Site contents""Click ""EDIT LINKS"" on the Quick Launch or the top navigation, depending on where you want to add a link.Click the app you want to add and drag it to where you want it on the navigation.(Refresh the page (F5) to see the animation again.)Click ""Save"".",Would you like to customize the navigation links? ,Would you like to customize the navigation links in SharePoint?
8849,EN,How can I install the backup client?,Install backup client,Please install the backup client for your operating system as described on this website:www.id.ethz.ch/services/list/storage/dbr/install/windows_EN,Please install the backup client for your operating system as described on this website:www.id.ethz.ch/services/list/storage/dbr/install/windows_EN,Install backup client,How can I install the backup client?
8965,EN,Information NSG,,"You were contacted from Mr. XXX because your PC is infected with  malware. Please clean your machine and give us a feedback. If you need  help with this, please contact your ISG.In chase of security we have to block your access to the ETH network. We will open it again when the problem is fixed. ","You were contacted from Mr. XXX because your PC is infected with  malware. Please clean your machine and give us a feedback. If you need  help with this, please contact your ISG.In chase of security we have to block your access to the ETH network. We will open it again when the problem is fixed. ",,Information NSG
8965,EN,Information NSG,,"You were contacted from Mr. XXX because your VPN username and password may be abused by an other person. So you have to reset your password and check your PC for maleware. If you need help with this, please contact your ISG.In chase of security we have to block your access to the ETH network. We will open it again when the problem is fixed. ","You were contacted from Mr. XXX because your VPN username and password may be abused by an other person. So you have to reset your password and check your PC for maleware. If you need help with this, please contact your ISG.In chase of security we have to block your access to the ETH network. We will open it again when the problem is fixed. ",,Information NSG
8968,EN,How can I install software from IDES?,,"Please download first all software local  to your computer with """"Map network drive"""", the computer must be on the  ETH Network, if not please start the VPN Client before. Then start the installation from your computer.Here you will find the instructions:VPN:https://www1.ethz.ch/id/servicedesk/guide/vpn/index_ENMap network drive to IDES: https://www1.ethz.ch/id/servicedesk/guide/ides/ides_manualIf the password from IDES will not accepted, please go to the webpage from ides (http://www.ides.ethz.ch)  and login, go to """"Voreinstellungen"""" and click on """"Passwort ändern"""" and  set again your nethz-password and try again to map a network drive.","Please download first all software local  to your computer with """"Map network drive"""", the computer must be on the  ETH Network, if not please start the VPN Client before. Then start the installation from your computer.Here you will find the instructions:VPN:https://www1.ethz.ch/id/servicedesk/guide/vpn/index_ENMap network drive to IDES: https://www1.ethz.ch/id/servicedesk/guide/ides/ides_manualIf the password from IDES will not accepted, please go to the webpage from ides (http://www.ides.ethz.ch)  and login, go to """"Voreinstellungen"""" and click on """"Passwort ändern"""" and  set again your nethz-password and try again to map a network drive.",,How can I install software from IDES?
8974,EN,Come by servicedesk,Come by servicedesk ,You can come to the service desk. It is at the HG E 11 and the openingstimes are:09:30-11:00 13:30-16:00,You can come to the service desk. It is at the HG E 11 and the openingstimes are:09:30-11:00 13:30-16:00,Come by servicedesk ,Come by servicedesk
8977,EN,Prepaid not loaded,Credit not loaded ,"The payment was stuck in the ""reservation"" stage, because you forgot to close the transaction with the ""close"" button.The payment is now completed and the money is available for printing. Please remember: always close the transaction window with the ""close"" button and wait until the ETH account summary is fully displayed after a payment. ","The payment was stuck in the ""reservation"" stage, because you forgot to close the transaction with the ""close"" button.The payment is now completed and the money is available for printing. Please remember: always close the transaction window with the ""close"" button and wait until the ETH account summary is fully displayed after a payment. ",Credit not loaded ,Prepaid not loaded
8984,EN,login for IDES network drive does not work,login for IDES network drive does not work ,Your password was seeked on your computer instead on our server. Please choose the field 'another Account' and type in your username. After entering your password the connection of your IDES network drive should work. ,Your password was seeked on your computer instead on our server. Please choose the field 'another Account' and type in your username. After entering your password the connection of your IDES network drive should work. ,login for IDES network drive does not work ,login for IDES network drive does not work
9001,EN,Wi-Fi interference,WLAN disorder - other required information to clarify ,,,WLAN disorder - other required information to clarify ,Wi-Fi interference
