ques_id,language,ques,ansTitle,ansContent,translation,translation_title,ques_translation
9023,DE,Möchten Sie in SharePoint gerne Websitesammlungsfeatures aktivieren oder deaktivieren?,Möchten Sie gerne Websitesammlungsfeatures aktivieren oder deaktivieren? ,"Als Administrator für SharePoint Server 2013 können Sie Features für eine Websitesammlung aktivieren und so für alle Websites innerhalb der Sammlung verfügbar machen. Sie können ein Feature auch deaktivieren, das nicht mehr benötigt wird. Beispielsweise müssen Sie, bevor Sie die  Veröffentlichungsvorlage zum Erstellen einer Veröffentlichungswebsite  verwenden können, zuerst die SharePoint Server-Veröffentlichungsinfrastruktur aktivieren. So aktivieren oder deaktivieren Sie ein Websitesammlungsfeature: Wechseln Sie zu Websiteeinstellungen >Websitesammlungsverwaltung >Websitesammlungsfeatures. Führen Sie eine der folgenden Aktionen aus:Klicken Sie auf ""Aktivieren"", um das Websitesammlungsfeature zu aktivieren.Klicken Sie auf ""Deaktivieren"", um das Websitesammlungsfeature zu deaktivieren.In manchen Fällen gibt es eine entsprechende Anwendung oder einen Dienst, die bzw. der installiert oder aktiviert werden muss, damit ein Websitesammlungsfeature funktioniert.","As an administrator for SharePoint Server 2013, you can enable features for a site collection, making it available to all sites within the collection. You can also disable a feature that is no longer needed. For example, before you can use the publishing template to create a publishing Web site, you must first enable the SharePoint Server publishing infrastructure. To enable or disable a site collection feature: Go to Site Settings&gt; Site Collection Administration&gt; Site Collection Features. Do one of the following: Click Enable to enable the site collection feature. Click Disable to disable the site collection feature. In some cases, there is an application or service that does must be installed or enabled for a site collection feature to work.",Would you like to enable or disable site collection features?,Do you want to enable or disable site collection features in SharePoint?
9024,DE,Möchten Sie gerne eine Freigebe eines Notizbuchs auf einer SharePoint-Website?,Möchten Sie gerne eine Freigebe eines Notizbuchs auf einer SharePoint-Website? ,"Wenn Ihre Organisation SharePoint verwendet, haben Sie die Möglichkeit, OneNote-Notizbücher an einem  zentralen Ort für das gesamte Team zu speichern. Sobald der Inhalt eines Notizbuchs von Ihnen oder einem Ihrer Kollegen geändert wird, werden die Notizen automatisch von OneNote gespeichert und in SharePoint  synchronisiert.Wichtig: Sie und Ihre Teamkollegen müssen über Lese-/Schreibberechtigungen für die SharePoint-Website verfügen. Wenn Sie diese Berechtigungen nicht besitzen, wenden Sie sich an den Systemadministrator.Sind die entsprechenden Berechtigungen vorhanden, gehen Sie wie folgt vor:Klicken Sie in OneNote 2013 auf Datei >Neu >SharePointKlicken Sie auf der rechten Seite unter ""SharePoint"" auf ""Durchsuchen""Wechseln Sie zu der Dokumentbibliothek auf der SharePoint-Website, in der Sie das Teamnotizbuch speichern möchtenGeben Sie einen aussagekräftigen und beschreibenden Namen in das Feld ""Notizbuchname"" ein, und klicken Sie dann auf ""Erstellen""","If your organization uses SharePoint, you can save OneNote notebooks in one central location for the entire team. Once the contents of a notebook are changed by you or one of your colleagues, notes are automatically saved by OneNote and synced to SharePoint. Important: You and your teammates must have Read / Write permissions to the SharePoint site. If you do not have these permissions, contact the system administrator. If you have the appropriate permissions, do the following: In OneNote 2013, click File&gt; New&gt; SharePoint On the right side of SharePoint, click Browse Go to the document library on the SharePoint Web site where you want to save the team notebookEnter a descriptive and descriptive name in the Notebook Name field, and then click Create.",Would you like to share a notebook on a SharePoint site?,Would you like to share a notebook on a SharePoint site?
9025,DE,Möchten Sie in SharePoint gerne Ihre Teamkollegen Benachrichtigen auf Ihr Notizbuch zu schrieben?,Möchten Sie gerne Ihre Teamkollegen Benachrichtigen auf Ihr Notizbuch zu schrieben? ,"Nachdem Sie das Notizbuch erstellt haben, können Sie den Teamkollegen und Mitarbeitern per E-Mail einen Link zum Notizbuch senden. Jeder  Benutzer mit Schreibberechtigungen für die SharePoint-Website kann die Notizen ebenfalls anzeigen und bearbeiten.Wenn Sie benachrichtigt werden möchten, sobald die Notizen in SharePoint von einem Benutzer aktualisiert werden, gehen Sie wie folgt vor:Wechseln Sie im Browser zu der Dokumentbibliothek, die das Notizbuch enthältKlicken Sie auf den Pfeil neben dem Notizbuchordner, um das Dropdownmenü zu öffnen, und klicken Sie dann auf ""Benachrichtigen""Wählen Sie im Dialogfeld ""Neue Benachrichtigung"" die Benachrichtigungsoption aus, die für Sie und Ihr Team am besten geeignet ist. Sie können z.B. tägliche Benachrichtigungen auswählen, wenn Ihre Teamkollegen nicht durch eine Vielzahl von Änderungsbenachrichtigungen gestört werden sollen.","After you&#39;ve created the notebook, you can send teammates and staff a link to the notebook via email. Anyone who has write permissions to the SharePoint site can also view and edit the notes. If you want to be notified when the notes in SharePoint are updated by a user, do the following: In the browser, navigate to the document library that contains the Include NotebookClick the arrow next to the notebook folder to open the drop-down menu, then click &quot;Notify.&quot; In the New Notification dialog box, select the notification option that works best for you and your team. For example, you can select daily notifications if your teammates are not to be disturbed by a large number of change notifications.",Would you like to notify your teammates to write to your notebook?,Would you like to write in SharePoint your teammates notify to write your notebook?
9027,DE,Was ist Breadcrumbs in Sharepoint?,Was ist Breadcrumbs? ,"Dieser Beitrag wird sehr kurz sein und ist vor allem Ihre Position im SharePoint zu darstellen. Sie haben wahrscheinlich schon bemerkt, dass die Breadcrumbs Funktionalität in Ihrer Sharepoint Website dargestellt wird.Was ist für Sie wichtig,sich daran zu erinnern wo Sie sich gerade befinden um einen klaren Überblick zu behalten.",This post will be very short and is above all your position in SharePoint to represent. You&#39;ve probably already noticed that Breadcrumbs functionality is displayed on your SharePoint site. What&#39;s important to you to remember where you are right now to keep a clear overview.,What is breadcrumbs?,Was ist Breadcrumbs in Sharepoint?
9030,DE,Möchten Sie in SharePoint eine Benachrichtigung für eine Liste oder Bibliothek erstellen?,Möchten Sie eine Benachrichtigung für eine Liste oder Bibliothek erstellen? ,"Wenn Sie über die Berechtigung zum Verwalten von Benachrichtigungen verfügen, können Sie durch Eingeben der entsprechenden Benutzerinformationen im Feld ""Benutzer"" eine Benachrichtigung auch für eine andere Person erstellen.Klicken Sie in der Liste oder Bibliothek, für die Sie eine Benachrichtigung erstellen möchten, im Menüband auf die Registerkarte ""Bibliothek"" oder ""Liste"" Je nach Listen- oder Bibliothekstyp, für den Sie eine Benachrichtigung erstellen möchten, wird ein anderer Registerkartenname angezeigt. Bei einer Kalenderliste ist es beispielsweise die Registerkarte ""Kalender""Klicken Sie in der Gruppe ""Freigeben und verfolgen"" auf ""Benachrichtigen"", und klicken Sie dann auf ""Benachrichtigung für diese Bibliothek festlegen""(In einer Liste lautet der entsprechende Befehl ""Benachrichtigung für diese Liste festlegen) Ändern Sie ggf. auf der Seite ""Neue Benachrichtigung"" im Abschnitt ""Benachrichtigungstitel den Titel für die Benachrichtigung. Der Titel wird in der Betreffzeile  der Benachrichtigungs-E-Mail angezeigt und außerdem zum Verwalten von Benachrichtigungen verwendet. Wählen Sie im Abschnitt ""Zustellungsmethode"" die gewünschte Zustellungsmethode für die Benachrichtigungen aus.Wenn die Optionen für ""Textnachricht (SMS)"" abgeblendet sind, ist möglicherweise keine Mobiltelefonnummer auf der Website gespeichert.Klicken Sie zum Speichern einer Mobiltelefonnummer oben auf der Website auf Ihren Namen, und klicken Sie dann auf ""Meine Einstellungen"". Klicken Sie dann auf der Seite ""Benutzerinformationen"" auf ""Eintrag bearbeiten"". Wenn Sie eine Mobiltelefonnummer gespeichert haben, die Optionen jedoch trotzdem abgeblendet sind, ist die Website möglicherweise nicht für ausgehende E-Mail und SMS Benachrichtigungen konfiguriert. Wenden Sie sich an den Serveradministrator.Wenn der Abschnitt ""Änderungstyp""verfügbar ist, wählen Sie die Typen von Änderungen aus, über die Sie benachrichtigt werden möchten. Sie können beispielsweise Benachrichtigungen über alle  Änderungen erhalten oder nur über das Löschen von Elementen informiert werden.Geben Sie im Abschnitt ""Für diese Änderungen Benachrichtigungen senden"" an, ob Sie über alle Typen von Änderungen oder über bestimmte Änderungen, z.B. bei allen Änderungen oder nur bei Änderungen, die jemand an einem von Ihnen erstellten oder kürzlich geänderten Element vornimmt, benachrichtigt werden möchten.Wählen Sie im Abschnitt ""Zeitpunkt des Versendens von Benachrichtigungen""aus, wie häufig (z.B. sofort oder in einer täglichen oder wöchentlichen Zusammenfassung) und an welchem Tag oder zu welcher Zeit  Sie Benachrichtigungen empfangen möchten. Klicken Sie auf ""OK"".","If you have permission to manage notifications, you can also create a notification for someone else by entering the appropriate user information in the User field. Click on the Ribbon in the list or library for which you want to create a notification to the Library or List tab Depending on the type of list or library for which you want to create a notification, another tab name is displayed. For example, for a calendar list, it is the Calendar tab. In the Share and Track group, click Notify, and then click Set Notification for This Library (in a list, the appropriate command is Notification for this Set List) If necessary, change the notification title in the Notification Title section of the New Notification page. The title appears in the subject line of the notification e-mail and is also used to manage notifications. In the &quot;Delivery method&quot; section, select the method of delivery for the notifications. If the &quot;Text message (SMS)&quot; options are dimmed, there may be no mobile phone number stored on the website. To save a mobile phone number, click your name at the top of the website , and then click &quot;My Settings.&quot; Then on the User Information page, click Edit Entry. If you have saved a mobile phone number but the options are still dimmed, the site may not be configured for outbound email and SMS alerts. Contact the server administrator. If the Change Type section is available, select the types of changes that you want to be notified about. For example, you can receive alerts about all changes, or just be notified about deleting items. In the &quot;Send alerts for these changes&quot; section, specify whether you want to be aware of all types of changes or changes, such as any changes or just Any changes that someone makes to an item that you have created or recently modified should be notified. In the section &quot;When to send notifications&quot;, select how often (eg, immediately or in a daily or weekly summary) and on which day or at which time you would like to receive notifications. Click OK&quot;.",Would you like to create a notification for a list or library?,Do you want to create a notification for a list or library in SharePoint?
9031,DE,"Möchten Sie in SharePoint Benachrichtigung für einen Ordner, eine Datei oder ein Listenelement erstellen?","Möchten Sie Benachrichtigung für einen Ordner, eine Datei oder ein Listenelement erstellen? ","Mithilfe des folgenden Verfahrens können Sie eine Benachrichtigung erstellen, um über Änderungen an einem Element in einer Liste, einem Dokument in einer Bibliothek oder einem Ordner in einer Liste oder  Bibliothek informiert zu bleiben. So können Sie z.B. eine Benachrichtigung einrichten, um bei Änderungen an einem Ereignis in einem Kalender oder einer Aufgabe in einer Aufgabenliste benachrichtigt  zu werden.Wenn Sie über die Berechtigung zum Verwalten von Benachrichtigungen verfügen, können Sie  auch durch Eingeben der entsprechenden Benutzerinformationen im Feld ""Benutze"" eine Benachrichtigung für eine andere Person erstellen.Zeigen Sie in der Liste oder Bibliothek, in der sich der Ordner, die Datei oder das Listenelement befindet, auf das betreffende Element, klicken Sie auf den daraufhin angezeigten Pfeil, und klicken Sie dann  auf ""Benachrichtigen"". In bestimmten Ansichten, z.B. ineiner Ansicht von Elementen in einem Kalender, müssen Sie möglicherweise zuerst auf das Element und anschliessend auf ""Benachrichtigen"" klicken. Ändern Sie ggf. auf der Seite ""Neue Benachrichtigung"" im Abschnitt ""Benachrichtigungstitel"" den Titel für die Benachrichtigung. Der Titel wird in der Betreffzeile der Benachrichtigungs-E-Mail angezeigt und außerdem zum Verwalten von Benachrichtigungen verwendet.Wählen Sie im Abschnitt ""Liefermethode"" die gewünschte Zustellungsmethode für die Benachrichtigungen aus.Wenn die Optionen für Textnachricht (SMS) abgeblendet sind, ist möglicherweise keine Mobiltelefonnummer auf der Website gespeichert. Klicken Sie auf den Hyperlink ""Benutzerinformationenseite"", um eine Mobiltelefonnummer zu speichern. Wenn Sie eine Mobiltelefonnummer gespeichert haben, die Optionen jedoch trotzdem abgeblendet sind, ist die Website möglicherweise nicht für ausgehende E-Mail konfiguriert. Wenden Sie sich an den Serveradministrator.Wenn der Abschnitt ""Änderungstyp""verfügbar ist, wählen Sie die Typen von Änderungen aus, über die Sie benachrichtigt werden möchten. Sie können beispielsweise Benachrichtigungen über alle Änderungen erhalten oder nur über das Löschen von Elementen informiert werden.Geben Sie im Abschnitt ""Für diese Änderungen Benachrichtigungen senden"" an, ob Sie über alle Typen von Änderungen oder über bestimmte  Änderungen, z.B. bei allen Änderungen oder nur bei Änderungen, die jemand an einem von Ihnen erstellten oder kürzlich geänderten Element vornimmt, benachrichtigt werden möchten.Wählen Sie im Abschnitt ""Zeitpunkt des Versendens von Benachrichtigungen"" aus, wie häufig (z.B. sofort oder in einer täglichen oder wöchentlichen Zusammenfassung) und an welchem Tag oder zu welcher Zeit  Sie Benachrichtigungen empfangen möchten.Bei mobilen Warnungen steht nur die Option ""Sofort senden"" zur Verfügung.Klicken Sie auf ""OK"".","Use the following procedure to create a notification to keep track of changes to an item in a list, a document in a library, or a folder in a list or library. For example, you can set up a notification to be notified of changes to an event in a calendar or task in a task list. If you have Manage Alerts permission, you can also type in the Use user information box &quot;create a notification for another person. In the list or library that contains the folder, file, or list item, point to the item, click the arrow that appears, and then click Notify &quot;. For example, in certain views, such as a view of items in a calendar, you may need to click the item first and then click &quot;Notify.&quot; If necessary, change the notification title in the Notification Title section of the New Notification page. The title appears in the subject line of the notification e-mail and is also used to manage notifications. In the Delivery Method section, select the method of delivery for the notifications. If the text message (SMS) options are dimmed, it may not be Mobile phone number stored on the website. Click the &quot;User Information Page&quot; hyperlink to save a mobile phone number. If you have saved a mobile phone number but the options are still dimmed, the site may not be configured for outbound email. Contact the server administrator. If the Change Type section is available, select the types of changes that you want to be notified about. For example, you can receive alerts about all changes, or just be notified about deleting items. In the &quot;Send alerts for these changes&quot; section, specify whether you want to be aware of all types of changes or changes, such as any changes or just Any changes that someone makes to an item that you have created or recently modified should be notified. In the section &quot;When to send notifications&quot;, select how often (eg, immediately or in a daily or weekly summary) and on which day or at which time you would like to receive notifications. For mobile alerts only the &quot;Send now&quot; option is available. Click &quot;OK&quot;.","Do you want to create notification for a folder, file, or list item?","Do you want to create notification for a folder, file, or list item in SharePoint?"
9032,DE,Möchten Sie in SharePoint RSS-Feeds abonnieren für eine Liste oder Bibliothek?,Möchten Sie RSS-Feeds abonnieren für eine Liste oder Bibliothek? ,"Je nach Browser oder Konfiguration des Systems steht dieses Verfahren möglicherweise nicht zur Verfügung, oder die Schritte können von den hier beschriebenen Schritten abweichen. Weitere Informationen erhalten Sie vom Websitebesitzer oder -administrator.Klicken Sie in der Liste oder Bibliothek, die Sie abonnieren möchten, im Menüband auf die Registerkarte ""Bibliothek"" oder ""Liste"".Je nach Listen- oder Bibliothekstyp, für den Sie eine Benachrichtigung erstellen möchten, wird ein anderer Registerkartenname angezeigt. Bei einer Kalenderliste ist es beispielsweise die Registerkarte ""Kalender"".  Tipp: Wenn Ihr Webbrowser das Abonniereneiner Ansicht zulässt, wird an diesem Punkt möglicherweise eine RSS-Symbolleistenschaltfläche aktiviert. Ist dies der Fall, können Sie möglicherweise darauf klicken, um die Liste oder Bibliothek direkt zu abonnieren. Wenn diese Funktion in Ihrem Browser nicht verfügbar ist,  können Sie die Schritte in der restlichen Vorgehensweise ausführen.Klicken Sie in der Gruppe ""Freigeben und verfolgen"" auf""RSS-Feed"". Der Feed wird in einem Browserfenster angezeigt. Folgen Sie auf der angezeigten Seite den Anweisungen zum Abonnieren des Feeds. Klicken Sie z.B. auf ""Feed abonnieren"". Folgen Sie etwaigen weiteren Anweisungen in Ihrem RSS-Reader, Browser oder E-Mail-Programm.Wenn Sie mit dem verwendeten Readerden Feed nicht über den entsprechenden Hyperlink abonnieren können, folgen Sie den Anweisungen in Ihrem RSS-Reader, um die URL des Feeds zu kopieren und im Reader einzufügen.","Depending on the browser or configuration of the system, this procedure may not be available or the steps may differ from the steps described here. For more information, contact the site owner or administrator. In the list or library you want to subscribe to, click the Library or List tab in the Ribbon. Depending on the list or library type you want to sign up for , another tab name is displayed. For example, for a calendar list, it&#39;s the Calendar tab. Tip: If your web browser allows you to subscribe to a view, an RSS toolbar button may be activated at this point. If so, you may be able to click on it to subscribe directly to the list or library. If this feature is not available in your browser, you can follow the steps in the rest of the procedure. In the Share and Track group, click RSS feed. The feed appears in a browser window. On the page that appears, follow the instructions to subscribe to the feed. For example, click on &quot;Subscribe to Feed&quot;. Follow any further instructions in your RSS reader, browser or e-mail program. If you can not subscribe to the Reader&#39;s feed you are using via the corresponding hyperlink, follow the instructions in your RSS reader to get the URL of the feed copy and paste in the reader.",Do you want to subscribe to RSS feeds for a list or library?,Do you want to subscribe to SharePoint RSS feeds for a list or library?
9033,DE,Möchten Sie in SharePoint ein RSS-Feeds abonnieren für eine Ansicht?,Möchten Sie ein RSS-Feeds abonnieren für eine Ansicht? ,"Wenn Sie über die Berechtigung zum Ändern einer Ansicht verfügen, können Sie einen RSS-Feed für eine bestimmte Ansicht abonnieren. Dadurch werden Sie über Änderungen an Informationen in Kenntnis gesetzt, die nur in dieser Ansicht angezeigt werden. In einigen Webbrowsern können Sie eine Ansicht abonnieren, indem Sie auf der Browsersymbolleiste auf eine RSS-Schaltfläche klicken.Klicken Sie in der Liste oder Bibliothek, die Sie abonnieren möchten, im Menüband auf die Registerkarte ""Bibliothek"" oder ""Liste""Je nach Listen- oder Bibliothekstyp, für den Sie eine Benachrichtigung erstellen möchten, wird ein anderer Registerkartenname angezeigt. Bei einer Kalenderliste ist es beispielsweise die Registerkarte ""Kalender"".Öffnen Sie die Ansicht, die Sie abonnieren möchten, indem Sie die Ansicht im Menüband in der Gruppe Klicken Sie auf Ansicht ändern, um die Ansicht zum Bearbeiten zu öffnenWenn die Option ""Ansicht ändern"" nicht im Menü ""Ansicht"" angezeigt wird, besitzen Sie keine Berechtigung zum Bearbeiten der Ansicht und können daher diese Methode zum Abonnieren des RSS-Feeds der  Ansicht nicht verwendenKlicken Sie im Abschnitt ""Name"" auf die RSS-SchaltflächeFolgen Sie auf der angezeigten Seite den Anweisungen zum Abonnieren des Feeds. Klicken Sie z.B. auf ""Feed abonnieren"".Folgen Sie etwaigen weiteren Anweisungen in Ihrem RSS-Reader, Browser oder E-Mail-Programm.  Wenn Sie mit dem verwendeten Reader den Feed nicht über den entsprechenden Hyperlink abonnieren können, folgen Sie den Anweisungen in Ihrem RSS-Reader, um die URL des Feeds zu kopieren und im Reader einzufügen.","If you have permission to modify a view, you can subscribe to an RSS feed for a particular view. This notifies you of any changes to information that only appears in this view. In some web browsers, you can subscribe to a view by clicking an RSS button on the browser toolbar. In the list or library you want to subscribe to, click the Library or List tab on the ribbon. or library type for which you want to create a notification, another tab name appears. For example, for a calendar list, it&#39;s the Calendar tab. Open the view you want to subscribe to by opening the view on the Ribbon in the group&#39;s Click View to open the view for editing when changing the view. does not have permission to edit the view, and therefore can not use this method to subscribe to the RSS feed of the view, click the RSS button in the &quot;Name&quot; sectionfollow the instructions on the page that appears to subscribe to the feed. For example, click on &quot;Subscribe to feed&quot;. Follow any further instructions in your RSS reader, browser or e-mail program. If you can not subscribe to the feed using the appropriate reader, follow the instructions in your RSS reader to copy the feed&#39;s URL and paste it into the Reader.",Would you like to subscribe to an RSS feed for a view?,Do you want to subscribe to an RSS feed in SharePoint for a view?
9034,DE,Was ist in SharePoint ein RSS-Feeds?,Was ist RSS-Feeds? ,"RSS-Feeds werden in einem RSS-Reader mit Aktualisierungen und Abonnements anderer Websites angezeigt. RSS ist eine Technologie, mit der Sie Aktualisierungen in einem standardisierten Format von mehreren Websites gleichzeitig erhalten können.Sie können RSS-Feeds für eine Liste oder Bibliothek oder sogar für eine Ansicht, in der Sie die Informationen gefiltert oder die Spalten angepasst haben, anzeigen und abonnieren.Bevor Sie RSS-Feeds erhalten können, muss der Serveradministrator in der Zentraladministration RSS-Feeds aktivieren, und der  Websiteadministrator muss auf der Seite ""Websiteeinstellungen"" RSS-Feeds für die Website aktiviert haben. ","RSS feeds are displayed in an RSS reader with updates and subscriptions from other websites. RSS is a technology that allows you to receive updates in a standardized format from multiple websites simultaneously. You can view RSS feeds for a list or library, or even for a view in which you have filtered or adjusted the information Before you can get RSS feeds, the server administrator must enable RSS feeds in Central Administration, and the site administrator must enable RSS feeds for the site on the Site Settings page.",What is RSS feeds?,What is an RSS feed in SharePoint?
9057,DE,Möchten Sie gerne des erforderlichen Ein- und Auscheckens in der SharePoint-Dokumentbibliothek deaktivieren?,Möchten Sie gerne des erforderlichen Ein- und Auscheckens in der SharePoint-Dokumentbibliothek deaktivieren? ,"Navigieren Sie in SharePoint zur Dokumentbibliothek.Klicken Sie im Menüband Bibliothekstools auf Bibliothek ""Bibliothekeinstellungen"">""Versionsverwaltungseinstellungen"".Legen Sie die Option Auschecken erfordern auf ""Nein"" fest.  ","In SharePoint, navigate to the document library. On the Library Tools ribbon, click Library Library Settings&gt; Versioning Settings. Set the Require Check Out option to No.",Would you like to disable the required check-in and check-out in the SharePoint document library?,Would you like to disable the required check-in and check-out in the SharePoint document library?
